[
  {
    "edge_id": "edge/timeline_connected/8b06b6cd9133408ad336",
    "edge_type": "timeline_connected",
    "episode_edges_version": "1.0.0",
    "evidence": "CrossReferencedEvent at 2026-05-20T11:25:52Z",
    "evidence_source": "timeline_CrossReferencedEvent",
    "source_pr_id": "github.com/PostHog/posthog#pr/45696",
    "source_pr_number": 45696,
    "strength": "strong",
    "target_kind": "pull_request",
    "target_number": 59183,
    "target_pr_in_dataset": true
  },
  {
    "edge_id": "edge/timeline_connected/cc5b170866c84663225a",
    "edge_type": "timeline_connected",
    "episode_edges_version": "1.0.0",
    "evidence": "CrossReferencedEvent at 2026-05-20T13:34:26Z",
    "evidence_source": "timeline_CrossReferencedEvent",
    "source_pr_id": "github.com/PostHog/posthog#pr/45696",
    "source_pr_number": 45696,
    "strength": "strong",
    "target_kind": "pull_request",
    "target_number": 59199,
    "target_pr_in_dataset": true
  },
  {
    "edge_id": "edge/timeline_connected/2c643dccfffb039e4a99",
    "edge_type": "timeline_connected",
    "episode_edges_version": "1.0.0",
    "evidence": "CrossReferencedEvent at 2026-05-20T14:21:35Z",
    "evidence_source": "timeline_CrossReferencedEvent",
    "source_pr_id": "github.com/PostHog/posthog#pr/45696",
    "source_pr_number": 45696,
    "strength": "strong",
    "target_kind": "pull_request",
    "target_number": 59212,
    "target_pr_in_dataset": true
  },
  {
    "edge_id": "edge/references_pr/9d47d8604d48292ca93c",
    "edge_type": "references_pr",
    "episode_edges_version": "1.0.0",
    "evidence": "efa25f7 Add 1.93.1 patch release f7ccc83 Merge pull request #177 from dtolnay/permitcopyrename 1c0547f Permit cross-device c",
    "evidence_source": "mention:body",
    "source_pr_id": "github.com/PostHog/posthog#pr/46473",
    "source_pr_number": 46473,
    "strength": "medium",
    "target_kind": "issue",
    "target_number": 177,
    "target_pr_in_dataset": null
  },
  {
    "edge_id": "edge/closes_issue/a65e197d2ae12c883ea1",
    "edge_type": "closes_issue",
    "episode_edges_version": "1.0.0",
    "evidence": "es e3991dd css: some adjustments to @import parsing 8bb82ca fix #3748, fix #4293: lower css media range syntax d8c3f87 css: parse",
    "evidence_source": "closing_keyword:body",
    "source_pr_id": "github.com/PostHog/posthog#pr/46785",
    "source_pr_number": 46785,
    "strength": "strong",
    "target_kind": "issue",
    "target_number": 3748,
    "target_pr_in_dataset": null
  },
  {
    "edge_id": "edge/closes_issue/54b2caa3c558963f499d",
    "edge_type": "closes_issue",
    "episode_edges_version": "1.0.0",
    "evidence": "media queries 6e75bc7 run make update-compat-table 8f506d5 fix #4292: support with { type: bytes } See full diff in compare view",
    "evidence_source": "closing_keyword:body",
    "source_pr_id": "github.com/PostHog/posthog#pr/46785",
    "source_pr_number": 46785,
    "strength": "strong",
    "target_kind": "issue",
    "target_number": 4292,
    "target_pr_in_dataset": null
  },
  {
    "edge_id": "edge/closes_issue/5e97b66d2be5d1400e4b",
    "edge_type": "closes_issue",
    "episode_edges_version": "1.0.0",
    "evidence": "css: some adjustments to @import parsing 8bb82ca fix #3748, fix #4293: lower css media range syntax d8c3f87 css: parse and print",
    "evidence_source": "closing_keyword:body",
    "source_pr_id": "github.com/PostHog/posthog#pr/46785",
    "source_pr_number": 46785,
    "strength": "strong",
    "target_kind": "issue",
    "target_number": 4293,
    "target_pr_in_dataset": null
  },
  {
    "edge_id": "edge/references_pr/68b92432f093b4bb4380",
    "edge_type": "references_pr",
    "episode_edges_version": "1.0.0",
    "evidence": "Problem The resource-level PR (#47130, already rolled out to 100%) hides entire system.* tables f",
    "evidence_source": "mention:body",
    "source_pr_id": "github.com/PostHog/posthog#pr/49264",
    "source_pr_number": 49264,
    "strength": "medium",
    "target_kind": "issue",
    "target_number": 47130,
    "target_pr_in_dataset": null
  },
  {
    "edge_id": "edge/references_pr/5f880c707aeadec2f431",
    "edge_type": "references_pr",
    "episode_edges_version": "1.0.0",
    "evidence": "l directly without exposing it as a system table \u2014 draft PR #60062.  Both rejected for the same reason: they re-implement the",
    "evidence_source": "mention:body",
    "source_pr_id": "github.com/PostHog/posthog#pr/49264",
    "source_pr_number": 49264,
    "strength": "medium",
    "target_kind": "pull_request",
    "target_number": 60062,
    "target_pr_in_dataset": true
  },
  {
    "edge_id": "edge/references_pr/5d39ff3e1b2b0d8e1878",
    "edge_type": "references_pr",
    "episode_edges_version": "1.0.0",
    "evidence": "nct resource_id overrides per (team, resource). Enforced in #60072   Org admins bypass object-level AC entirely; the deny set",
    "evidence_source": "mention:body",
    "source_pr_id": "github.com/PostHog/posthog#pr/49264",
    "source_pr_number": 49264,
    "strength": "medium",
    "target_kind": "pull_request",
    "target_number": 60072,
    "target_pr_in_dataset": true
  },
  {
    "edge_id": "edge/timeline_connected/8654922c170244aaa7d2",
    "edge_type": "timeline_connected",
    "episode_edges_version": "1.0.0",
    "evidence": "CrossReferencedEvent at 2026-02-26T18:07:50Z",
    "evidence_source": "timeline_CrossReferencedEvent",
    "source_pr_id": "github.com/PostHog/posthog#pr/49264",
    "source_pr_number": 49264,
    "strength": "strong",
    "target_kind": "issue",
    "target_number": 47130,
    "target_pr_in_dataset": null
  },
  {
    "edge_id": "edge/timeline_connected/33490d2d871d05e0ea8f",
    "edge_type": "timeline_connected",
    "episode_edges_version": "1.0.0",
    "evidence": "CrossReferencedEvent at 2026-06-05T19:44:53Z",
    "evidence_source": "timeline_CrossReferencedEvent",
    "source_pr_id": "github.com/PostHog/posthog#pr/49264",
    "source_pr_number": 49264,
    "strength": "strong",
    "target_kind": "pull_request",
    "target_number": 60034,
    "target_pr_in_dataset": true
  },
  {
    "edge_id": "edge/timeline_connected/96d156514bb77fd43098",
    "edge_type": "timeline_connected",
    "episode_edges_version": "1.0.0",
    "evidence": "CrossReferencedEvent at 2026-05-26T12:10:47Z",
    "evidence_source": "timeline_CrossReferencedEvent",
    "source_pr_id": "github.com/PostHog/posthog#pr/49264",
    "source_pr_number": 49264,
    "strength": "strong",
    "target_kind": "pull_request",
    "target_number": 60062,
    "target_pr_in_dataset": true
  },
  {
    "edge_id": "edge/timeline_connected/8c531d71bd3d302fab54",
    "edge_type": "timeline_connected",
    "episode_edges_version": "1.0.0",
    "evidence": "CrossReferencedEvent at 2026-05-26T12:54:34Z",
    "evidence_source": "timeline_CrossReferencedEvent",
    "source_pr_id": "github.com/PostHog/posthog#pr/49264",
    "source_pr_number": 49264,
    "strength": "strong",
    "target_kind": "pull_request",
    "target_number": 60072,
    "target_pr_in_dataset": true
  },
  {
    "edge_id": "edge/timeline_connected/bee36da1126adc3f8b93",
    "edge_type": "timeline_connected",
    "episode_edges_version": "1.0.0",
    "evidence": "CrossReferencedEvent at 2026-06-04T12:47:15Z",
    "evidence_source": "timeline_CrossReferencedEvent",
    "source_pr_id": "github.com/PostHog/posthog#pr/49264",
    "source_pr_number": 49264,
    "strength": "strong",
    "target_kind": "pull_request",
    "target_number": 61614,
    "target_pr_in_dataset": true
  },
  {
    "edge_id": "edge/timeline_connected/9be3d8858c509d5f4c80",
    "edge_type": "timeline_connected",
    "episode_edges_version": "1.0.0",
    "evidence": "CrossReferencedEvent at 2026-06-05T16:09:33Z",
    "evidence_source": "timeline_CrossReferencedEvent",
    "source_pr_id": "github.com/PostHog/posthog#pr/49264",
    "source_pr_number": 49264,
    "strength": "strong",
    "target_kind": "pull_request",
    "target_number": 61889,
    "target_pr_in_dataset": true
  },
  {
    "edge_id": "edge/timeline_connected/77bdabeaa70f7ad2dbad",
    "edge_type": "timeline_connected",
    "episode_edges_version": "1.0.0",
    "evidence": "CrossReferencedEvent at 2026-07-01T12:48:51Z",
    "evidence_source": "timeline_CrossReferencedEvent",
    "source_pr_id": "github.com/PostHog/posthog#pr/49264",
    "source_pr_number": 49264,
    "strength": "strong",
    "target_kind": "pull_request",
    "target_number": 67392,
    "target_pr_in_dataset": true
  },
  {
    "edge_id": "edge/follow_up/0431c3d05c142544e32c",
    "edge_type": "follow_up",
    "episode_edges_version": "1.0.0",
    "evidence": "hat fires $messaging_email_* events) lives in the follow-up #60212, which reads the table this PR creates. This PR alone chang",
    "evidence_source": "phrase:follow_up+mention",
    "source_pr_id": "github.com/PostHog/posthog#pr/50122",
    "source_pr_number": 50122,
    "strength": "medium",
    "target_kind": "pull_request",
    "target_number": 60212,
    "target_pr_in_dataset": true
  },
  {
    "edge_id": "edge/shared_feature_flag/17beea1395d265c5f882",
    "edge_type": "shared_feature_flag",
    "episode_edges_version": "1.0.0",
    "evidence": "both touch feature flag 'WORKFLOWS_ENGAGEMENT_EVENTS'",
    "evidence_source": "feature_flag_cooccurrence",
    "source_pr_id": "github.com/PostHog/posthog#pr/50122",
    "source_pr_number": 50122,
    "strength": "weak",
    "target_kind": "pull_request",
    "target_number": 69900,
    "target_pr_in_dataset": true
  },
  {
    "edge_id": "edge/timeline_connected/a1426cb0a5ade355f4c2",
    "edge_type": "timeline_connected",
    "episode_edges_version": "1.0.0",
    "evidence": "CrossReferencedEvent at 2026-05-29T12:16:54Z",
    "evidence_source": "timeline_CrossReferencedEvent",
    "source_pr_id": "github.com/PostHog/posthog#pr/50122",
    "source_pr_number": 50122,
    "strength": "strong",
    "target_kind": "issue",
    "target_number": 17121,